{
  "$schema": "http://json-schema.org/draft-07/schema#",
  "$id": "plugin-manifest.schema.json",
  "title": "Nexora Plugin Manifest",
  "description": "Schema for the manifest.json file required by every Nexora database driver plugin.",
  "type": "object",
  "required": [
    "id",
    "name",
    "version",
    "executable",
    "capabilities",
    "data_types"
  ],
  "additionalProperties": false,
  "properties": {
    "id": {
      "type": "string",
      "pattern": "^[a-z0-9-]+$",
      "description": "Unique driver identifier (lowercase letters, digits, hyphens). Must match the plugin folder name."
    },
    "name": {
      "type": "string",
      "description": "Display name shown in the UI (e.g. \"DuckDB\")."
    },
    "version": {
      "type": "string",
      "pattern": "^\\d+\\.\\d+\\.\\d+$",
      "description": "Plugin version in semver format (e.g. \"1.0.0\")."
    },
    "description": {
      "type": "string",
      "description": "Short description shown in the plugins list."
    },
    "default_port": {
      "type": ["integer", "null"],
      "description": "Default TCP port for the database. Use null for file-based databases."
    },
    "is_builtin": {
      "type": "boolean",
      "default": false,
      "description": "true for built-in drivers shipped with Nexora. External plugins should omit this field or set it to false."
    },
    "default_username": {
      "type": "string",
      "default": "",
      "description": "Default username pre-filled in the connection modal (e.g. \"postgres\", \"root\"). Leave empty if there is no conventional default."
    },
    "executable": {
      "type": "string",
      "description": "Relative path to the plugin executable inside the plugin folder (without extension on Linux/macOS; Nexora appends .exe on Windows automatically)."
    },
    "capabilities": {
      "type": "object",
      "description": "Feature flags that control which UI elements Nexora renders for this driver.",
      "required": [
        "schemas",
        "views",
        "routines",
        "file_based",
        "identifier_quote",
        "alter_primary_key"
      ],
      "additionalProperties": false,
      "properties": {
        "schemas": {
          "type": "boolean",
          "description": "true if the database supports named schemas (e.g. PostgreSQL). Shows the schema selector in the connection UI."
        },
        "views": {
          "type": "boolean",
          "description": "true to enable the Views section in the database explorer."
        },
        "routines": {
          "type": "boolean",
          "description": "true to enable stored procedures and functions in the database explorer."
        },
        "routine_management": {
          "type": "boolean",
          "default": false,
          "description": "true to enable routine management actions (run with parameters, create from template, edit, drop). The backing RPCs (build_routine_call_sql, routine_create_template, get_routine_edit_script, drop_routine) are optional: the host falls back to dialect-neutral SQL when the plugin does not implement them."
        },
        "triggers": {
          "type": "boolean",
          "default": false,
          "description": "true if the driver supports trigger metadata and trigger management RPCs."
        },
        "file_based": {
          "type": "boolean",
          "description": "true for local file databases (e.g. SQLite, DuckDB). Replaces the host/port fields with a file path input."
        },
        "folder_based": {
          "type": "boolean",
          "default": false,
          "description": "true for plugins that connect to a directory rather than a single file (e.g. CSV plugin). Replaces host/port fields with a folder picker."
        },
        "connection_string": {
          "type": "boolean",
          "default": true,
          "description": "Optional capability for network drivers. Set false to hide connection string import in the UI."
        },
        "connectionString": {
          "type": "boolean",
          "default": true,
          "description": "CamelCase alias of connection_string. Optional capability for network drivers."
        },
        "connection_string_example": {
          "type": "string",
          "default": "",
          "description": "Optional placeholder example shown in the connection string field (e.g. \"postgres://user:pass@localhost:5432/db\")."
        },
        "connectionStringExample": {
          "type": "string",
          "default": "",
          "description": "CamelCase alias of connection_string_example."
        },
        "identifier_quote": {
          "type": "string",
          "enum": ["\"", "`"],
          "description": "Character used to quote SQL identifiers: double-quote for ANSI SQL, backtick for MySQL-style."
        },
        "sql_dialect": {
          "type": "string",
          "enum": ["postgres", "mysql", "mssql", "sqlite", "oracle", "generic"],
          "default": "postgres",
          "description": "SQL dialect used by Nexora for statement splitting and query classification. Oracle-like plugins can use oracle."
        },
        "alter_primary_key": {
          "type": "boolean",
          "description": "true if the database supports altering primary keys after table creation."
        },
        "auto_increment_keyword": {
          "type": "string",
          "default": "",
          "description": "Keyword appended after the column type for auto-increment columns (e.g. \"AUTO_INCREMENT\" for MySQL). Empty string if not applicable."
        },
        "serial_type": {
          "type": "string",
          "default": "",
          "description": "Replacement data type used for auto-increment columns (e.g. \"SERIAL\" for PostgreSQL). Empty string if not applicable."
        },
        "inline_pk": {
          "type": "boolean",
          "default": false,
          "description": "true if primary key is defined inline in the column definition (e.g. SQLite AUTOINCREMENT style)."
        },
        "alter_column": {
          "type": "boolean",
          "default": false,
          "description": "true if the driver supports ALTER TABLE MODIFY/ALTER COLUMN on existing tables."
        },
        "create_foreign_keys": {
          "type": "boolean",
          "default": false,
          "description": "true if the driver properly supports creating foreign key constraints."
        },
        "no_connection_required": {
          "type": "boolean",
          "default": false,
          "description": "true for API-based plugins that need no host/port/credentials (e.g. public REST APIs). Hides the entire connection form and skips database validation."
        },
        "manage_tables": {
          "type": "boolean",
          "default": true,
          "description": "true if the driver supports table and column management (CREATE TABLE, ADD/MODIFY/DROP COLUMN, DROP TABLE). Does not control index or foreign key operations. Defaults to true."
        },
        "readonly": {
          "type": "boolean",
          "default": false,
          "description": "When true, the driver is read-only: all data modification operations (INSERT, UPDATE, DELETE) are disabled in the UI. Table and column management is also hidden regardless of manage_tables. Defaults to false."
        },
        "supports_ssl": {
          "type": "boolean",
          "default": false,
          "description": "true to show the SSL/TLS configuration tab (mode + CA/client cert/key) in the connection modal for this network driver. Defaults to false."
        }
      }
    },
    "interpreter": {
      "type": "string",
      "description": "Optional interpreter for script-based plugins (e.g. python3)."
    },
    "settings": {
      "type": "array",
      "description": "Optional list of configuration fields the plugin exposes to the user.",
      "items": {
        "type": "object",
        "required": ["key", "label", "type"],
        "additionalProperties": false,
        "properties": {
          "key": { "type": "string" },
          "label": { "type": "string" },
          "type": {
            "type": "string",
            "enum": ["string", "boolean", "number", "select"]
          },
          "default": {},
          "description": { "type": "string" },
          "required": { "type": "boolean", "default": false },
          "options": { "type": "array", "items": { "type": "string" } }
        }
      }
    },
    "data_types": {
      "type": "array",
      "description": "List of SQL data types supported by this driver for column creation in the UI.",
      "items": {
        "type": "object",
        "required": [
          "name",
          "category",
          "requires_length",
          "requires_precision"
        ],
        "additionalProperties": false,
        "properties": {
          "name": {
            "type": "string",
            "description": "SQL type name as it appears in DDL (e.g. \"VARCHAR\", \"BIGINT\")."
          },
          "category": {
            "type": "string",
            "enum": [
              "numeric",
              "string",
              "date",
              "binary",
              "json",
              "spatial",
              "other"
            ],
            "description": "UI grouping category for this type."
          },
          "requires_length": {
            "type": "boolean",
            "description": "true if this type requires a length argument (e.g. VARCHAR(255))."
          },
          "requires_precision": {
            "type": "boolean",
            "description": "true if this type requires a precision/scale argument (e.g. DECIMAL(10,2))."
          },
          "default_length": {
            "type": "string",
            "description": "Optional default length value pre-filled in the UI (e.g. \"255\" for VARCHAR)."
          }
        }
      }
    }
  }
}
